{
  "title": "Hamnet",
  "sinopsis": "After losing their son Hamnet to plague...",
  "year": 2025,
  "director": "Chloé Zhao",
  "genres": ["Drama", "Romance"],
  "certification": "PG-13",
  "rating": 7.9,
  "numRatings": 65000,
  "duration": 125,
  "stars": ["Jessie Buckley", "Paul Mescal", "Zac Wishart"]
}